{
  "schema_version": "0.3.0",
  "official_id": "2015122300020807",
  "pdf_sha256": "ecf4a3f2da9a75976de662566050b04e2bfcd58c34a18a2bef3cfc61ab76c252",
  "coverage": "partial",
  "applicant_evaluation": false,
  "as_of": {
    "date": "2026-09-17",
    "fact_id": "eligibility-date"
  },
  "rules": [
    {
      "id": "age-default",
      "applies_to": "일반 성년 기준",
      "source_text": "19세 미만은 원칙적으로 신청 불가. 법정대리인의 동의 또는 대리를 통한 미성년자 예외가 있음.",
      "fact_id": "age-default",
      "exception_of": null,
      "predicate": {
        "kind": "age_minimum",
        "years": 19
      }
    },
    {
      "id": "age-child",
      "applies_to": "자녀 양육 미성년 세대주",
      "source_text": "법정대리인의 동의 또는 대리; 자녀를 양육하는 세대주인 미성년자; 자녀가 신청자와 같은 세대별 주민등록표에 등재",
      "fact_id": "age-child",
      "exception_of": "age-default",
      "predicate": {
        "kind": "manual_exception",
        "requirements": [
          "법정대리인의 동의 또는 대리",
          "자녀를 양육하는 세대주인 미성년자",
          "자녀가 신청자와 같은 세대별 주민등록표에 등재"
        ]
      }
    },
    {
      "id": "age-sibling",
      "applies_to": "형제자매 부양 미성년 세대주",
      "source_text": "법정대리인의 동의 또는 대리; 직계존속의 사망, 실종선고 및 행방불명 등으로 형제자매를 부양하여야 하는 세대주인 미성년자; 형제자매가 신청자와 같은 세대별 주민등록표에 등재",
      "fact_id": "age-sibling",
      "exception_of": "age-default",
      "predicate": {
        "kind": "manual_exception",
        "requirements": [
          "법정대리인의 동의 또는 대리",
          "직계존속의 사망, 실종선고 및 행방불명 등으로 형제자매를 부양하여야 하는 세대주인 미성년자",
          "형제자매가 신청자와 같은 세대별 주민등록표에 등재"
        ]
      }
    },
    {
      "id": "age-foreign-parent",
      "applies_to": "외국인 부 또는 모가 있는 한부모가족 미성년 세대주",
      "source_text": "법정대리인의 동의 또는 대리; 부 또는 모가 외국인인 한부모가족; 미성년 자녀(내국인)가 세대주",
      "fact_id": "age-foreign-parent",
      "exception_of": "age-default",
      "predicate": {
        "kind": "manual_exception",
        "requirements": [
          "법정대리인의 동의 또는 대리",
          "부 또는 모가 외국인인 한부모가족",
          "미성년 자녀(내국인)가 세대주"
        ]
      }
    },
    {
      "id": "age-youth-engaged",
      "applies_to": "청년 또는 예비신혼부부의 미성년 예외",
      "source_text": "법정대리인의 동의 또는 대리; 청년 또는 예비신혼부부",
      "fact_id": "age-youth-engaged",
      "exception_of": "age-default",
      "predicate": {
        "kind": "manual_exception",
        "requirements": [
          "법정대리인의 동의 또는 대리",
          "청년 또는 예비신혼부부"
        ]
      }
    },
    {
      "id": "housing-default",
      "applies_to": "무주택세대구성원 일반 기준",
      "source_text": "세대구성원 전원이 주택(분양권 등 포함)을 소유하지 않은 세대의 구성원. 세대 정의·주택소유 인정 예외의 일부 원문 검토는 완료했으며 외부 법령·현재 유효성 및 전체 판정은 미완료.",
      "fact_id": "housing-default",
      "exception_of": null,
      "predicate": {
        "kind": "housing_scope",
        "scope": "household"
      }
    },
    {
      "id": "housing-youth",
      "applies_to": "청년 계층의 주택소유 검증 대상",
      "source_text": "청년 계층은 주택소유여부를 신청자 본인에 한하여 검증. 소득·자산 검증 대상까지 본인으로 축소하는 규칙은 아님.",
      "fact_id": "housing-youth",
      "exception_of": "housing-default",
      "predicate": {
        "kind": "housing_scope",
        "scope": "applicant"
      }
    },
    {
      "id": "housing-elderly",
      "applies_to": "혼인 중이 아니며 단독세대주로 입주하려는 고령자 계층의 주택소유 검증 대상",
      "source_text": "혼인 중이 아니며 단독세대주로 입주하려는 고령자 계층은 주택소유여부를 신청자 본인에 한하여 검증. 전체 고령자에게 일괄 적용하지 않음.",
      "fact_id": "housing-elderly",
      "exception_of": "housing-default",
      "predicate": {
        "kind": "housing_scope",
        "scope": "applicant"
      }
    },
    {
      "id": "housing-engaged",
      "applies_to": "예비신혼부부의 주택소유 검증 대상",
      "source_text": "예비신혼부부는 혼인으로 구성될 세대의 세대구성원 모두를 대상으로 주택소유여부 검증.",
      "fact_id": "housing-engaged",
      "exception_of": "housing-default",
      "predicate": {
        "kind": "housing_scope",
        "scope": "future_household"
      }
    },
    {
      "id": "household-applicant",
      "applies_to": "세대 정의: 신청자",
      "source_text": "적용 차원 household_definition; 신청자는 세대구성원에 포함",
      "fact_id": "household-applicant",
      "exception_of": null,
      "predicate": {
        "kind": "reviewed_all_of",
        "dimension": "household_definition",
        "requirements": [
          "신청자는 세대구성원에 포함"
        ]
      }
    },
    {
      "id": "household-spouse",
      "applies_to": "세대 정의: 배우자",
      "source_text": "적용 차원 household_definition; 신청자의 배우자는 세대구성원에 포함; 신청자와 주민등록상 세대 분리된 배우자도 포함",
      "fact_id": "household-spouse",
      "exception_of": null,
      "predicate": {
        "kind": "reviewed_all_of",
        "dimension": "household_definition",
        "requirements": [
          "신청자의 배우자는 세대구성원에 포함",
          "신청자와 주민등록상 세대 분리된 배우자도 포함"
        ]
      }
    },
    {
      "id": "household-direct-family",
      "applies_to": "세대 정의: 직계가족 첫 그룹",
      "source_text": "적용 차원 household_definition; 신청자의 직계존속, 배우자의 직계존속, 신청자의 직계비속 및 그 배우자; 신청자 또는 분리배우자의 세대별 주민등록표에 함께 등재된 사람에 한함",
      "fact_id": "household-direct-family",
      "exception_of": null,
      "predicate": {
        "kind": "reviewed_all_of",
        "dimension": "household_definition",
        "requirements": [
          "신청자의 직계존속, 배우자의 직계존속, 신청자의 직계비속 및 그 배우자",
          "신청자 또는 분리배우자의 세대별 주민등록표에 함께 등재된 사람에 한함"
        ]
      }
    },
    {
      "id": "household-spouse-descendants",
      "applies_to": "세대 정의: 배우자 직계비속 그룹",
      "source_text": "적용 차원 household_definition; 배우자의 직계비속 및 그 배우자; 신청자의 세대별 주민등록표에 함께 등재된 사람에 한함",
      "fact_id": "household-spouse-descendants",
      "exception_of": null,
      "predicate": {
        "kind": "reviewed_all_of",
        "dimension": "household_definition",
        "requirements": [
          "배우자의 직계비속 및 그 배우자",
          "신청자의 세대별 주민등록표에 함께 등재된 사람에 한함"
        ]
      }
    },
    {
      "id": "household-foreign-spouse",
      "applies_to": "세대 정의: 외국인 배우자",
      "source_text": "적용 차원 household_definition; 공고일 현재 가족관계등록부에 등재; 외국인등록 또는 국내거소신고를 완료해 사실증명 가능; 신청자와 같은 주소에 거주하지 않아도 포함",
      "fact_id": "household-foreign-spouse",
      "exception_of": null,
      "predicate": {
        "kind": "reviewed_all_of",
        "dimension": "household_definition",
        "requirements": [
          "공고일 현재 가족관계등록부에 등재",
          "외국인등록 또는 국내거소신고를 완료해 사실증명 가능",
          "신청자와 같은 주소에 거주하지 않아도 포함"
        ]
      }
    },
    {
      "id": "household-foreign-family",
      "applies_to": "세대 정의: 외국인 직계존·비속",
      "source_text": "적용 차원 household_definition; 공고일 현재 가족관계등록부에 등재; 외국인등록 또는 국내거소신고 완료; 신청자 또는 분리배우자의 등본에 기재되어 있거나 등록 체류지·거소가 그 주민등록표 주소와 동일",
      "fact_id": "household-foreign-family",
      "exception_of": null,
      "predicate": {
        "kind": "reviewed_all_of",
        "dimension": "household_definition",
        "requirements": [
          "공고일 현재 가족관계등록부에 등재",
          "외국인등록 또는 국내거소신고 완료",
          "신청자 또는 분리배우자의 등본에 기재되어 있거나 등록 체류지·거소가 그 주민등록표 주소와 동일"
        ]
      }
    },
    {
      "id": "household-exclusion-missing",
      "applies_to": "세대 제외: 실종선고",
      "source_text": "적용 차원 household_definition; 실종선고 절차가 진행 중인 사람; 신청자 본인이 입증서류 제출",
      "fact_id": "household-exclusion-missing",
      "exception_of": null,
      "predicate": {
        "kind": "reviewed_all_of",
        "dimension": "household_definition",
        "requirements": [
          "실종선고 절차가 진행 중인 사람",
          "신청자 본인이 입증서류 제출"
        ]
      }
    },
    {
      "id": "household-exclusion-runaway",
      "applies_to": "세대 제외: 가출·행방불명",
      "source_text": "적용 차원 household_definition; 경찰서 등 행정관청 신고 후 1개월 경과 또는 관할 시장·군수·구청장 등이 가출·행방불명 사실 확인; 신청자 본인이 입증서류 제출",
      "fact_id": "household-exclusion-runaway",
      "exception_of": null,
      "predicate": {
        "kind": "reviewed_all_of",
        "dimension": "household_definition",
        "requirements": [
          "경찰서 등 행정관청 신고 후 1개월 경과 또는 관할 시장·군수·구청장 등이 가출·행방불명 사실 확인",
          "신청자 본인이 입증서류 제출"
        ]
      }
    },
    {
      "id": "household-exclusion-separate",
      "applies_to": "세대 제외: 생계·주거 분리",
      "source_text": "적용 차원 household_definition; 국민기초생활 보장법 시행령 제2조 제1항 제1호에 해당하는 사람과 생계 및 주거를 달리한다고 시장·군수·구청장 등이 확인; 신청자 본인이 입증서류 제출",
      "fact_id": "household-exclusion-separate",
      "exception_of": null,
      "predicate": {
        "kind": "reviewed_all_of",
        "dimension": "household_definition",
        "requirements": [
          "국민기초생활 보장법 시행령 제2조 제1항 제1호에 해당하는 사람과 생계 및 주거를 달리한다고 시장·군수·구청장 등이 확인",
          "신청자 본인이 입증서류 제출"
        ]
      }
    },
    {
      "id": "assets-scope-default",
      "applies_to": "assets 일반 검증 대상",
      "source_text": "자산 검증 대상: 세대구성원 전체; 계층별 예외와 공급유형별 요건을 함께 확인",
      "fact_id": "assets-scope-default",
      "exception_of": null,
      "predicate": {
        "kind": "resource_scope",
        "resource": "assets",
        "scope": "household",
        "requirements": [
          "계층별 예외와 공급유형별 요건을 함께 확인"
        ]
      }
    },
    {
      "id": "assets-scope-youth",
      "applies_to": "assets 청년 검증 대상",
      "source_text": "자산 검증 대상: 신청자 본인; 다만 세대원이 있는 세대의 세대주인 청년은 세대구성원 전체를 검증",
      "fact_id": "assets-scope-youth",
      "exception_of": "assets-scope-default",
      "predicate": {
        "kind": "resource_scope",
        "resource": "assets",
        "scope": "applicant",
        "requirements": [
          "다만 세대원이 있는 세대의 세대주인 청년은 세대구성원 전체를 검증"
        ]
      }
    },
    {
      "id": "assets-scope-engaged",
      "applies_to": "assets 예비신혼부부 검증 대상",
      "source_text": "자산 검증 대상: 혼인으로 구성될 세대 전체; 예비신혼부부에 한함",
      "fact_id": "assets-scope-engaged",
      "exception_of": "assets-scope-default",
      "predicate": {
        "kind": "resource_scope",
        "resource": "assets",
        "scope": "future_household",
        "requirements": [
          "예비신혼부부에 한함"
        ]
      }
    },
    {
      "id": "assets-elderly",
      "applies_to": "고령자 assets 검증 대상",
      "source_text": "적용 차원 assets; 고령자는 세대구성원 전체를 검증; 혼인 중이 아니며 단독세대주로 입주하려는 경우도 포함",
      "fact_id": "assets-elderly",
      "exception_of": null,
      "predicate": {
        "kind": "reviewed_all_of",
        "dimension": "assets",
        "requirements": [